{
  "schemaVersion": "1.2.0",
  "correlacao": {
    "idOperacao": "OP-2026-000124"
  },
  "documento": {
    "tipoDocumento": "PROPOSTA_CREDITO"
  },
  "cliente": {
    "tipoPessoa": "PF",
    "dadosPF": {
      "nomeCompleto": "Cliente Exemplo Inválido",
      "cpf": "123.456.789-01",
      "dataNascimento": "2026-02-31"
    },
    "endereco": {
      "logradouro": "Rua do Exemplo Inválido",
      "cidade": "Recife"
    }
  },
  "cadastro": {
    "rendaMensal": 8500.00
  },
  "financiamento": {
    "tipo": "IMOBILIARIO",
    "imobiliario": {
      "valorImovel": -400000.00,
      "valorEntrada": 80000.123,
      "prazoMeses": 0,
      "taxaJurosMensal": 0.95,
      "sistemaAmortizacao": "SACRE"
    }
  },
  "score": {
    "scoreFinal": 1500,
    "faixaRisco": "OTIMO",
    "probabilidadeDefault": 0.5,
    "modelo": {
      "codigo": "SCORE_PJ"
    },
    "calculatedAt": "2026-09-25T18:30:00-03:00",
    "origem": "CACHE",
    "componentes": []
  },
  "decisao": {
    "resultado": "PENDENTE"
  },
  "operacaoFinanceira": {
    "numeroOperacao": "OP-26-124",
    "status": "QUITADA"
  }
}
